{
  "_meta": {
    "page_name": "online-enhance-template-id14451",
    "template_version": "1.0.0",
    "generated_at": "2026-04-20"
  },

  "hero": {
    "headline": {
      "value": "Make Video Clearer Online Free",
      "notes": "控制在 10 个单词以内，含核心关键词"
    },
    "subtitle": {
      "value": "Unlock the power of advanced AI video enhancer to denoise, sharpen, and upscale your videos directly in your browser. No software installation, no hidden costs—just stunning, high-definition results in seconds."
    },
    "cta_primary": {
      "href": "https://online.hitpaw.com/apps/ai-video/video-enhancer?source=seo",
      "text": "Enhance Video Now",
      "sub": "No Installation Required",
      "class": "btn btn3 btn-primary buyBtn complexBtn position-relative overflow-hidden border-0"
    },
    "cta_secondary": {
      "href": "https://online.hitpaw.com/pricing.html",
      "text": "See Pricing Plans",
      "class": "small text-black text-decoration-underline"
    },
    "cta_mobile": {
      "href": "https://online.hitpaw.com/apps/ai-video/video-enhancer?source=seo",
      "text": "Try It Online",
      "sub": "",
      "class": "btn btn3 btn-primary buyBtn complexBtn sys-ios"
    },
    "image": {
      "value": "https://online.hitpaw.com/images/online-tools-land/video-enhancer/make-video-clear-tool.webp",
      "alt_text": "make video clearer online for free",
      "notes": "建议尺寸 600x400，16:9 或 4:3 皆可"
    }
  },

  "steps": {
    "title": { "value": "How to Make Video Clearer Online Free", "level": "h2" },
    "cta": {
      "href": "https://online.hitpaw.com/apps/ai-video/video-enhancer?source=seo",
      "text": "Enhance Video Online",
      "class": "btn btn-xl btn3 buyBtn btn-primary uploadBtn"
    },
    "step_1": {
      "num": "01",
      "title": "Upload Video File Online",
      "desc": "Drag and drop your video file (MP4, MOV, AVI, etc.) into our AI video enhancer.",
      "image_url": "https://online.hitpaw.com/images/online-tools-land/video-enhancer/upload-video-online.png",
      "image_alt": "upload video file online"
    },
    "step_2": {
      "num": "02",
      "title": "Choose AI Enhancement Model",
      "desc": "Choose an enhancement model and AI will make the video clearer online automatically.",
      "image_url": "https://online.hitpaw.com/images/online-tools-land/video-enhancer/choose-ai-enhancement-model.png",
      "image_alt": "choose ai video enhancement model"
    },
    "step_3": {
      "num": "03",
      "title": "Export Enhanced Video File",
      "desc": "Check the enhanced result and export your high-quality video instantly.",
      "image_url": "https://online.hitpaw.com/images/online-tools-land/video-enhancer/export-enhanced-video.png",
      "image_alt": "export enhanced video file"
    }
  },

  "features": {
    "title": { "value": "Easily Make Video Clearer with HitPaw AI Video Clearer Tool", "level": "h2" },
    "feature_1": {
      "title": "AI-Powered Denoising & Sharpening",
      "desc": "Utilizing state-of-the-art deep learning algorithms, our AI denoising and sharpening tool can automatically restore clarity in videos with visible noise or motion blur.",
      "image_url": "https://online.hitpaw.com/images/online-tools-land/video-enhancer/sharpening-video-online.webp",
      "image_alt": "ai sharpen video online",
      "link": { "href": "https://online.hitpaw.com/apps/ai-video/video-enhancer?source=seo", "text": "Make Video Clearer", "class": "text-primary d-flex align-items-center justify-content-center justify-content-lg-start" }
    },
    "feature_2": {
      "title": "One-Click Upscaling up to 4K",
      "desc": "Upscale your low-resolution footage to stunning 4K quality. Our AI intelligently adds realistic details, making every frame look sharper and more professional.",
      "image_url": "https://online.hitpaw.com/images/online-tools-land/video-enhancer/upscaling-video-to-4k-online.webp",
      "image_alt": "upscale video to 4k online",
      "link": { "href": "https://online.hitpaw.com/apps/ai-video/video-enhancer?source=seo", "text": "Make Video Clearer", "class": "text-primary d-flex align-items-center justify-content-center justify-content-lg-start" }
    },
    "feature_3": {
      "title": "Smooth Frame Interpolation",
      "desc": "Interpolate additional frames into your videos to achieve buttery-smooth playback at 60fps or higher. Perfect for slow-motion sequences or older footage.",
      "image_url": "https://online.hitpaw.com/images/online-tools-land/video-enhancer/make-video-high-quality-online.webp",
      "image_alt": "make video high quality online",
      "link": { "href": "https://online.hitpaw.com/apps/ai-video/video-enhancer?source=seo", "text": "Make Video Clearer", "class": "text-primary d-flex align-items-center justify-content-center justify-content-lg-start" }
    }
  },

  "use_cases": {
    "title": { "value": "HitPaw Online AI Video Enhancer for Everyone", "level": "h2" },
    "desc": {
      "value": "From fixing shaky handheld clips to restoring old family memories, our online video enhancer provides professional-grade results without any editing skills."
    },
    "use_case_1": { "title": "Content Creator & Social Media Optimization", "image_url": "https://online.hitpaw.com/images/online-tools-land/video-enhancer/content-creator.webp", "image_alt": "enhance video for content creator" },
    "use_case_2": { "title": "Surveillance & Meeting Recording", "image_url": "https://online.hitpaw.com/images/online-tools-land/video-enhancer/surveillance.webp", "image_alt": "enhance surveillance & meeting recording online" },
    "use_case_3": { "title": "Restoring Precious Family Memories", "image_url": "https://online.hitpaw.com/images/online-tools-land/video-enhancer/restoring-family-memories.webp", "image_alt": "restore vintage family memories" },
    "use_case_4": { "title": "Professional Business & Marketing", "image_url": "https://online.hitpaw.com/images/online-tools-land/video-enhancer/enhance-product-ads.webp", "image_alt": "enhance video for business and marketing" },
    "use_case_5": { "title": "Upscale Anime & Gaming Videos", "image_url": "https://online.hitpaw.com/images/online-tools-land/video-enhancer/enhance-anime-online.webp", "image_alt": "upscale anime and gaming video" },
    "use_case_6": { "title": "Improve Low-Light Footage", "image_url": "", "image_alt": "" }
  },

  "more_tools": {
    "title": { "value": "More Than Just an Online Video Enhancer", "level": "h2" },
    "tool_1": { "title": "Online Photo Enhancer", "desc": "Enhance photo quality effortlessly with advanced AI technology.", "image_url": "https://online.hitpaw.com/images/2024-v3/product/video-enhancer/online-photo-enhancer.webp", "image_alt": "online photo enhancer", "link_href": "https://online.hitpaw.com/online-photo-enhancer.html", "link_text": "Online Photo Enhancer" },
    "tool_2": { "title": "AI Video Generator", "desc": "No skills needed — generate stunning videos from text or images in minutes.", "image_url": "https://online.hitpaw.com/images/2024-v3/product/video-enhancer/ai-video-generator.webp", "image_alt": "ai video generator", "link_href": "https://online.hitpaw.com/online-ai-video-generator.html", "link_text": "AI Video Generator" },
    "tool_3": { "title": "AI Dance Generator", "desc": "Turn a still photo into a dancing video with realistic motion.", "image_url": "https://online.hitpaw.com/images/2024-v3/product/video-enhancer/ai-dance-generator.webp", "image_alt": "ai dance generator", "link_href": "https://online.hitpaw.com/ai-dance-generator.html", "link_text": "AI Dance Generator" },
    "tool_4": { "title": "Photo Watermark Remover", "desc": "Remove unwanted watermarks from photos with one click, no quality loss.", "image_url": "https://online.hitpaw.com/images/2024-v3/product/video-enhancer/photo-watermark-remover.webp", "image_alt": "photo watermark remover", "link_href": "https://online.hitpaw.com/photo-watermark-remover.html", "link_text": "Photo Watermark Remover" }
  },

  "faq": {
    "title": { "value": "FAQs About Online Video Enhancer", "level": "h2" },
    "faq_1": {
      "question": "Q1: What's the easiest way to improve a blurry video online?",
      "answer": "The most effective method is using an AI-driven tool that can make video clearer online free. Instead of simple filters, our <a href='https://online.hitpaw.com/online-video-enhancer.html'>online video enhancer</a> reconstructs missing details at the pixel level, allowing you to restore sharpness and professional clarity with just a single click."
    },
    "faq_2": {
      "question": "Q2: Is it possible to fix blurry videos recorded in low light?",
      "answer": "Our AI video quality enhancer specializes in cleaning up grainy footage. It removes digital noise and balances exposure to make the video clearer and more professional, even if the original was shot in poor lighting."
    },
    "faq_3": {
      "question": "Q3: Can I improve video resolution online for old family movies?",
      "answer": "Absolutely. HitPaw's online AI video enhancer can upscale old VHS tapes and low-resolution home movies to HD or even 4K, bringing new life to your precious memories."
    },
    "faq_4": {
      "question": "Q4: Can AI actually fix footage that looks grainy or pixelated?",
      "answer": "Yes. Our AI was trained on millions of videos and can intelligently fill in missing details and reduce compression artifacts, making grainy or pixelated footage appear smooth and sharp."
    }
  },

  "tips": {
    "title": { "value": "Tips & Tricks for Online AI Video Enhancer", "level": "h2" },
    "tip_1": { "link_href": "https://online.hitpaw.com/learn/how-to-enhance-video-quality-online.html", "link_text": "· How to Enhance Video Quality Online For Free Easily", "link_class": "text-black" },